Id	Name	Desc	EffectDesc	Icon	Rare	RogueSimVolatilityGroupId	IsShowCity	BuffIds	Effect	Params
1	Coconut Expert	King of <color=#a46800>Coconuts</color>. Best choice for beginners.	<color=#a46800>Coconut</color> price +30%	Assets/Product/Texture/Image/IconTools/IconFangKuai10.png	5	1	True	[11, 21, 22, 23]		
2	Production Master	Generate profit out of nowhere.	Vegetable harvest building profit +20%	Assets/Product/Texture/Image/IconTools/IconFangKuai12.png	5	2	True	[12]		
3	Marketing Celestial	The secrets of becoming the best salesperson.	Item sale CRIT rate +20%	Assets/Product/Texture/Image/IconTools/UiTemple2icon01.png	5	3	True	[13]		
4	Financing Hero	If you don't manage your finances, money won't come to you. Of course, even if you do, it still might not.	Unlocks the bank from the beginning.\nHeroes can't run away from challenges!	Assets/Product/Texture/Image/IconTools/ItFool01.png	5	4	True			
5	Civil Engineering	Free hammering.	Free Constructions +2 every quarter\nMain City level-ups no longer grant Production	Assets/Product/Texture/Image/IconTools/IconActivityConsumeTic2001001.png	5	5	True	[14]		
6	Transcendence	When you gaze into the void, the void gazes back.	Receive +20 Production\nMain City Level capped at 1	Assets/Product/Texture/Image/IconTools/IconDoubleTowerCoin.png	5	6	True			
