Id	Name	Desc	Icon	MaxCount
1	Merchant EXP	The EXP earned from explorations and events. Can be used to upgrade the Main City.	Assets/Product/Texture/Image/IconTools/IconRogueSim01.png	9999999
2	Golden Shell	Earned from trades and explorations. Can be used to upgrade the Main City or purchase islands. The number of Golden Shells will affect your final points.	Assets/Product/Texture/Image/IconTools/IconRogueSimTwo02.png	1999999999
3	Production	Indicates the base production efficiency of each product. Can be increased by upgrading the Main City.	Assets/Product/Texture/Image/IconTools/UiFingerGuessing2Img6.png	9999999
4	Exploration Points	Indicate the number of explorations that can be carried out each quarter. Will be replenished to the maximum at the beginning of the next quarter.	Assets/Product/Texture/Image/IconTools/IconRogueSim07.png	9999
5	Visibility	The area visible to you during the exploration.	Assets/Product/Texture/Image/IconToolsSp/IconZhanquGognxunzhi.png	3
6	Free Construction	Free lunches can be real! Construct buildings at no cost.	Assets/Product/Texture/Image/IconToolsSp/IconZhanquGognxunzhi.png	9999
