Id	EquipName	Level	AttType	SuitId	BaseAttFightEventIds	BaseAttDesc	EffectDesc	EffectGroupId	Icon	TraitName	TraitDesc	StoryDesc	UseType	PosType	GlobalFightEventIds	SimpleEffectDesc	RecordDamage	QubitEffectGroupId	QubitEffectDesc	QubitSampleEffectDesc	QubitTraitName	QubitTraitDesc	QubitGlobalFightEventIds
2201	Wu'an I	1		22	[2251097]	['Shield']	· Upon dealing damage, receives a shield equal to <color=#4a70b9>10%</color> of max HP, stacking up to <color=#4a70b9>100%</color>of max HP for <color=#4a70b9>5</color>s (refreshes when obtained repeatedly).	20311	Assets/Product/Texture/Image/IconToolsSp/EWuanjunI01001Sp.png				2	1		· Receives a shield upon dealing damage.		21311	· Upon dealing damage, receives a shield equal to <color=#17f5cf>15%</color> of max HP, stacking up to <color=#17f5cf>150%</color>of max HP for <color=#17f5cf>5</color>s (refreshes when obtained repeatedly).	· Receives a shield upon dealing damage.			
2202	Wu'an II	1		22	[2251098]	['Shield', 'Additional DMG']	· Upon dealing damage, consumes <color=#b73a3a>30%</color> of the shield to deal Elemental DMG equal to the consumed shield x<color=#4a70b9>4500%</color> to surrounding enemies (same element as the bearer's), with a <color=#4a70b9>2</color>s cooldown.	20312	Assets/Product/Texture/Image/IconToolsSp/EWuanjunI02001Sp.png				2	2		· Consumes a portion of the shield to inflict extra Elemental DMG.		21312	· Upon dealing damage, consumes <color=#b73a3a>50%</color> of the shield to deal Elemental DMG equal to the consumed shield x<color=#17f5cf>9000%</color> to surrounding enemies (same element as the bearer's), with a <color=#17f5cf>2</color>s cooldown.	· Consumes a portion of the shield to inflict extra Elemental DMG.			
2203	Wu'an III	1		22	[2251098]	['Shield', 'Take Hit']	· Upon taking damage, deals Elemental DMG equal to shield x<color=#4a70b9>5000%</color> to surround enemies (same element as the bearer's), with a <color=#4a70b9>2</color>s cooldown.	20313	Assets/Product/Texture/Image/IconToolsSp/EWuanjunI03001Sp.png				2	3		· Upon taking damage, deals Extra DMG to enemies based on the shield.		21313	· Upon taking damage, deals Elemental DMG equal to shield x<color=#17f5cf>10000%</color> to surround enemies (same element as the bearer's), with a <color=#17f5cf>2</color>s cooldown.	· Upon taking damage, deals Extra DMG to enemies based on the shield.			
2301	Cleopatra I	1	6	23	[2251097]	['Nihil', 'DMG Increase']	· Upon dealing damage, Nihil DMG <color=#4a70b9>+15%</color>, stacking up to <color=#4a70b9>30%</color> for <color=#4a70b9>15</color>s (refreshes when obtained repeatedly).	20291	Assets/Product/Texture/Image/IconToolsSp/ECleopatraI01001Sp.png				1	1		· Upon dealing damage, grants Nihil DMG Bonus.		21291	· Upon dealing damage, Nihil DMG <color=#17f5cf>+15%</color>, stacking up to <color=#17f5cf>50%</color> for <color=#17f5cf>15</color>s (refreshes when obtained repeatedly).	· Upon dealing damage, grants Nihil DMG Bonus.			
2302	Cleopatra II	1	6	23	[2251098]	['Nihil', 'Additional DMG']	· Upon dealing damage, inflicts Nihil DMG equal to <color=#4a70b9>720%</color> of ATK, with a <color=#4a70b9>1</color>s cooldown.	20292	Assets/Product/Texture/Image/IconToolsSp/ECleopatraI02001Sp.png				1	2		· Upon dealing damage, inflicts additional Nihil DMG.		21292	· Upon dealing damage, inflicts Nihil DMG equal to <color=#17f5cf>1080%</color> of ATK, with a <color=#17f5cf>1</color>s cooldown.	· Upon dealing damage, inflicts additional Nihil DMG.			
2303	Cleopatra III	1	6	23	[2251098]	['Nihil', 'RES Reduction']	· Upon dealing damage, Enemy Nihil RES <color=#4a70b9>-30%</color> for <color=#4a70b9>15</color>s (refreshes when obtained repeatedly).	20293	Assets/Product/Texture/Image/IconToolsSp/ECleopatraI03001Sp.png				1	3		· Upon dealing damage, reduces Enemy Nihil RES.		21293	· Upon dealing damage, Enemy Nihil RES <color=#17f5cf>-40%</color> for <color=#17f5cf>15</color>s (refreshes when obtained repeatedly).	· Upon dealing damage, reduces Enemy Nihil RES.			
5001	Aline I	1		50	[2251097]	['QTE']	· Upon dealing damage (QTE included), Enemy Extra DMG Reduction <color=#4a70b9>-50%</color> for <color=#4a70b9>8</color>s.	20171	Assets/Product/Texture/Image/IconToolsSp/EYileinuoyaI01001Sp.png				3	1		· After dealing damage, significantly reduces the enemy's Extra DMG Reduction for a certain duration.		21171	· Upon dealing damage (QTE included), Enemy Extra DMG Reduction <color=#17f5cf>-70%</color> for <color=#17f5cf>8</color>s.	· After dealing damage, significantly reduces the enemy's Extra DMG Reduction for a certain duration.			
5002	Aline II	1		50	[2251098]	['QTE', 'Matrix']	· Upon QTE entrance, triggers Matrix and another character's QTE, with an <color=#4a70b9>8</color>s cooldown.	20172	Assets/Product/Texture/Image/IconToolsSp/EYileinuoyaI02001Sp.png				3	2		· Upon QTE entrance, triggers Matrix and another character's QTE, with an <color=#4a70b9>8</color>s cooldown.		21172	· Upon QTE entrance, triggers Matrix and another character's QTE, with an <color=#17f5cf>5</color>s cooldown.	· Upon QTE entrance, triggers Matrix and another character's QTE, with an <color=#17f5cf>5</color>s cooldown.			
5101	Richelieu I	1		51	[2251097]	['Heal', 'DMG Increase']	· Upon healing, grants the target Extra DMG Bonus <color=#4a70b9>+60%</color> for <color=#4a70b9>8</color>s.	20181	Assets/Product/Texture/Image/IconToolsSp/ELisailiuI01001Sp.png				3	1		· Upon healing, grants the target a significant Extra DMG Bonus for a short period.		21181	· Upon healing, grants the target Extra DMG Bonus <color=#17f5cf>+100%</color> for <color=#17f5cf>8</color>s.	· Upon healing, grants the target a significant Extra DMG Bonus for a short period.			
5102	Richelieu II	1		51	[2251098]	['Signal Orb', 'Dodge Gauge']	· Upon healing, grants the target <color=#4a70b9>1</color> random set of <color=#4a70b9>3</color>-Ping Orbs and <color=#4a70b9>500</color> Dodge Gauge, with a <color=#4a70b9>3</color>s cooldown.	20182	Assets/Product/Texture/Image/IconToolsSp/ELisailiuI02001Sp.png				3	2		· Upon healing, grants the target <color=#4a70b9>3</color>-Ping Orbs and Dodge Gauge, with a <color=#4a70b9>3</color>s cooldown.		21182	· Upon healing, grants the target <color=#17f5cf>2</color> random sets of <color=#17f5cf>3</color>-Ping Orbs and <color=#17f5cf>500</color> Dodge Gauge, with a <color=#17f5cf>3</color>s cooldown.	· Upon healing, grants the target <color=#17f5cf>3</color>-Ping Orbs and Dodge Gauge, with a <color=#17f5cf>3</color>s cooldown.			
5201	Ike I	1		52	[2251097]	['Switch', 'Signature Energy']	· When switched into battle, Signature Energy <color=#4a70b9>+100%</color> and clears all Signature Energy owned after <color=#4a70b9>10</color>s.	20191	Assets/Product/Texture/Image/IconToolsSp/EAikeI01001Sp.png				3	1		· When switched into battle, grants a large amount of Signature Energy and clears it after a certain period.		21191	· When switched into battle, Signature Energy and Signature DMG <color=#17f5cf>+100%</color>. Clears all Signature Energy and Signature DMG Bonus owned after <color=#17f5cf>10</color>s.	· When switched into battle, grants a large amount of Signature Energy and Signature DMG Bonus. Clears them after a certain period.			
5202	Ike II	1		52	[2251098]	['Switch', 'DMG Increase']	· When switched into battle, Extra DMG Bonus <color=#4a70b9>+100%</color> and grants <color=#4a70b9>5</color> sets of <color=#4a70b9>3</color>-Ping Orbs, lasting <color=#4a70b9>10</color>s before this effect is removed.	20192	Assets/Product/Texture/Image/IconToolsSp/EAikeI02001Sp.png				3	2		· When switched into battle, grants a significant Extra DMG Bonus and multiple sets of Signal Orbs, removed after a certain duration.		21192	· When switched into battle, Extra DMG Bonus <color=#17f5cf>+200%</color> and grants <color=#17f5cf>5</color> sets of <color=#17f5cf>3</color>-Ping Orbs, lasting <color=#17f5cf>10</color>s before this effect is removed.	· When switched into battle, grants a significant Extra DMG Bonus and multiple sets of Signal Orbs, removed after a certain duration.			
5301	Aife I	1		53	[2251097]	['Standby Buff', 'Signature Energy']	· When casting Signature Move, grants standby characters Signature Energy equal to <color=#4a70b9>50%</color> of the bearer's consumed amount.	20201	Assets/Product/Texture/Image/IconToolsSp/EAifuI01001Sp.png				3	1		· When casting Signature Move, grants standby characters Signature Energy equal to some of the bearer's consumed amount.		21201	· When casting Signature Move, grants standby characters Signature Energy equal to <color=#17f5cf>50%</color> of the bearer's consumed amount and increases the Energy limit by that much.	· When casting Signature Move, grants standby characters Signature Energy equal to some of the bearer's consumed amount and increases the Energy limit by that much.			
5302	Aife II	1		53	[2251098]	['Switch']	· Upon entering and leaving the field, triggers Matrix.	20202	Assets/Product/Texture/Image/IconToolsSp/EAifuI02001Sp.png				3	2		· Upon entering and leaving the field, triggers Matrix.		21202	· Upon entering and leaving the field, triggers Matrix and QTE.	· Upon entering and leaving the field, triggers Matrix and QTE.			
5401	Elizabeth I	1		54	[2251097]	['On-field Buff']	· On standby, increases ATK and HP by <color=#4a70b9>50%</color> of the bearer's stats for characters on the field.	20211	Assets/Product/Texture/Image/IconToolsSp/EYilishabaiI01001Sp.png				3	1		· On standby, grants ATK and HP Bonuses to characters on the field based on the bearer's stats.		21211	· On standby, increases ATK and HP by <color=#17f5cf>100%</color> of the bearer's stats for characters on the field.	· On standby, grants ATK and HP Bonuses to characters on the field based on the bearer's stats.			
5402	Elizabeth II	1		54	[2251098]	['DMG Transfer']	· On standby, transfers <color=#4a70b9>50%</color> of the damage taken by characters on the field to the bearer, disabled when the bearer's HP falls below <color=#b73a3a>20%</color>.	20212	Assets/Product/Texture/Image/IconToolsSp/EYilishabaiI02001Sp.png				3	2		· On standby, transfers a portion of the damage taken on the field to the bearer.		21212	· On standby, transfers <color=#17f5cf>70%</color> of the damage taken by characters on the field to the bearer, disabled when the bearer's HP falls below <color=#b73a3a>10%</color>.	· On standby, transfers a portion of the damage taken on the field to the bearer.			
5501	Unimate I	1		55	[2251097]	['Class Buff']	· For every <color=#4a70b9>1</color> character of a unique class in the team, all members' ATK and HP <color=#4a70b9>+30%</color>, stacking up to <color=#4a70b9>60%</color>.	20221	Assets/Product/Texture/Image/IconToolsSp/EYounimeiteI01001Sp.png				3	1		· The more varied classes in the team, the greater the boost to all members' ATK and HP.		21221	· For every <color=#17f5cf>1</color> character of a unique class in the team, all members' ATK and HP <color=#17f5cf>+40%</color>, stacking up to <color=#17f5cf>80%</color>.	· The more varied classes in the team, the greater the boost to all members' ATK and HP.			
5502	Unimate II	1		55	[2251098]	['Class Buff']	· For every <color=#4a70b9>1</color> character of a unique class in the team, all members gain <color=#4a70b9>2</color> Signature Energy per second, stacking up to <color=#4a70b9>4</color> per second.	20222	Assets/Product/Texture/Image/IconToolsSp/EYounimeiteI02001Sp.png				3	2		· The more varied classes in the team, the more Signature Energy all members gain per second.		21222	· For every <color=#17f5cf>1</color> character of a unique class in the team, all members gain <color=#17f5cf>3</color> Signature Energy per second, stacking up to <color=#17f5cf>6</color> per second.	· The more varied classes in the team, the more Signature Energy all members gain per second.			
5601	Alice I	1		56	[2251097]	['Bloodburn', 'Collateral Damage']	· Upon entering the field (QTE included), consumes <color=#b73a3a>45%</color> of Max HP to deal Elemental DMG equal to <color=#4a70b9>(consumed HP x4)%</color> of ATK to all enemies on the field (same element as the bearer's, not effective with insufficient HP).\n· On standby, recovers <color=#4a70b9>10%</color> of Max HP per second.	20231	Assets/Product/Texture/Image/IconToolsSp/EAliceI01001Sp.png				3	1		· Upon entering the field (QTE included), consumes HP to deal Elemental DMG to all enemies on the field.\n· On standby, recovers HP over time.		21231	· Upon entering the field (QTE included), consumes <color=#b73a3a>45%</color> of Max HP to deal Elemental DMG equal to <color=#17f5cf>(consumed HP x6)%</color> of ATK to all enemies on the field (same element as the bearer's, not effective with insufficient HP).\n· On standby, recovers <color=#17f5cf>10%</color> of Max HP per second.	· Upon entering the field (QTE included), consumes HP to deal Elemental DMG to all enemies on the field.\n· On standby, recovers HP over time.			
5602	Alice II	1		56	[2251098]	['Bloodburn', 'Collateral Damage']	· Upon entering the field (QTE included), consumes <color=#b73a3a>45%</color> of Max HP to deal Elemental DMG equal to <color=#4a70b9>(consumed HP x4)%</color> of ATK to all enemies on the field (same element as the bearer's, not effective with insufficient HP).\n· On standby, recovers <color=#4a70b9>10%</color> of Max HP per second.	20232	Assets/Product/Texture/Image/IconToolsSp/EAliceI01001Sp.png				3	2		· Upon entering the field (QTE included), consumes HP to deal Elemental DMG to all enemies on the field.\n· On standby, recovers HP over time.		21232	· Upon entering the field (QTE included), consumes <color=#b73a3a>45%</color> of Max HP to deal Elemental DMG equal to <color=#17f5cf>(consumed HP x6)%</color> of ATK to all enemies on the field (same element as the bearer's, not effective with insufficient HP).\n· On standby, recovers <color=#17f5cf>10%</color> of Max HP per second.	· Upon entering the field (QTE included), consumes HP to deal Elemental DMG to all enemies on the field.\n· On standby, recovers HP over time.			
5701	Gloria I	1		57	[2251097]	['Support', 'Collateral Damage']	· On standby, for every <color=#b73a3a>7</color> Signal Orbs pinged on the field, grants <color=#4a70b9>1</color> Missile Support that deals Elemental DMG equal to <color=#4a70b9>777%</color> of the bearer's ATK (same element as the bearer's).	20241	Assets/Product/Texture/Image/IconToolsSp/EGeluodaI01001Sp.png				3	1		· On standby, grants Missile Support upon a certain number of orbs pinged on the field.		21241	· On standby, for every <color=#b73a3a>7</color> Signal Orbs pinged on the field, grants <color=#17f5cf>1</color> Missile Support that deals Elemental DMG equal to <color=#17f5cf>1111%</color> of the bearer's ATK (same element as the bearer's).	· On standby, grants Missile Support upon a certain number of orbs pinged on the field.			
5702	Gloria II	1		57	[2251098]	['Support', 'Collateral Damage']	· On standby, for every <color=#b73a3a>70</color> Signature Energy consumed on the field, grants <color=#4a70b9>1</color> Missile Support that deals Elemental DMG equal to <color=#4a70b9>777%</color> of the bearer's ATK (same element as the bearer's).	20242	Assets/Product/Texture/Image/IconToolsSp/EGeluodaI02001Sp.png				3	2		· On standby, grants Missile Support upon a certain amount of Signature Energy consumed on the field.		21242	· On standby, for every <color=#b73a3a>70</color> Signature Energy consumed on the field, grants <color=#17f5cf>1</color> Missile Support that deals Elemental DMG equal to <color=#17f5cf>1111%</color> of the bearer's ATK (same element as the bearer's).	· On standby, grants Missile Support upon a certain amount of Signature Energy consumed on the field.			
5801	Carrielynn I	1		58	[2251097]	['Switch', 'Attack']	· Upon member switch, the bearer's ATK <color=#4a70b9>+20%</color>, stacking up to <color=#4a70b9>80%</color>.	20271	Assets/Product/Texture/Image/IconToolsSp/ELongmeierI01001Sp.png				3	1		· Upon member switch, the bearer's ATK increases.		21271	· Upon member switch, the bearer's ATK <color=#17f5cf>+20%</color>, stacking up to <color=#17f5cf>120%</color>.	· Upon member switch, the bearer's ATK increases.			
5802	Carrielynn II	1		58	[2251098]	['Switch']	· Upon a 3-Ping, standby members' switch cooldown <color=#4a70b9>-5</color>s.	20272	Assets/Product/Texture/Image/IconToolsSp/ELongmeierI02001Sp.png				3	2		· Upon a 3-Ping, standby members' switch cooldown decreases.		21272	· Upon a 3-Ping or casting Signature, standby members' switch cooldown <color=#17f5cf>-5</color>s.	· Upon a 3-Ping or casting Signature, standby members' switch cooldown decreases.			
5901	Alphonse I	1		59	[2251097]	['Standby Buff']	· On standby, gains <color=#4a70b9>3%</color> of the ATK and Max HP of the character on the battlefield every second, up to <color=#4a70b9>15</color> times (shared among members)	20281	Assets/Product/Texture/Image/IconToolsSp/EAlphonseI01001Sp.png				3	1		· On standby, gains ATK and HP from the character on the battlefield over time.		21281	· On standby, gains <color=#17f5cf>5%</color> of the ATK and Max HP of the character on the battlefield every second, up to <color=#17f5cf>15</color> times (shared among members)	· On standby, gains ATK and HP from the character on the battlefield over time.			
5902	Alphonse II	1		59	[2251098]	['Standby Buff', 'Damage Record']	· When entering the battlefield due to a QTE, records the damage by the character on the battlefield within <color=#4a70b9>8</color>s. Cooldown: <color=#4a70b9>8</color>s. (The recorded value will be reset when the effect is triggered again.)\n· When switched in, deals True DMG equal to <color=#4a70b9>45%</color> of the recorded damage to all enemies on the battlefield. (The recorded value will be reset after the damage is dealt.)	20282	Assets/Product/Texture/Image/IconToolsSp/EAlphonseI02001Sp.png				3	2		· When entering the battlefield due to a QTE, records the damage by the character on the battlefield.\n· When switched in, deals True DMG based on the recorded damage to all enemies on the battlefield.		21282	· When entering the battlefield due to a QTE, records the damage by the character on the battlefield within <color=#17f5cf>8</color>s. Cooldown: <color=#17f5cf>8</color>s. (The recorded value will be reset when the effect is triggered again.)\n· When switched in, deals True DMG equal to <color=#17f5cf>65%</color> of the recorded damage to all enemies on the battlefield. (The recorded value will be reset after the damage is dealt.)	· When entering the battlefield due to a QTE, records the damage by the character on the battlefield.\n· When switched in, deals True DMG based on the recorded damage to all enemies on the battlefield.			
6001	Koya I	1		60	[2251097]		· When entering the battlefield due to a QTE, creates a [<u>Slowing Field</u>] for <color=#4a70b9>10</color>s (the field resets upon a repeated trigger).	20341	Assets/Product/Texture/Image/IconToolsSp/EKeyaI02001Sp.png	['Slowing Field']	"[""· All enemies' Movement Speed <color=#4a70b9>-60%</color> in the field.\\n· All units' ATK <color=#4a70b9>+100%</color> in the field (including enemy units).""]"		3	1		· When entering the battlefield due to a QTE, creates a [<u>Slowing Field</u>].		21341	· When entering the battlefield due to a QTE, creates a [<u>Stasis Field</u>] for <color=#17f5cf>10</color>s (the field resets upon a repeated trigger).	· When entering the battlefield due to a QTE, creates a [<u>Stasis Field</u>].	['Stasis Field']	"[""· All enemies' Movement Speed <color=#17f5cf>-90%</color> in the field.\\n· All units' ATK <color=#17f5cf>+200%</color> in the field (including enemy units).""]"	
6002	Koya II	1		60	[2251098]		· Upon QTE entrance, grants [<u>Acceleration</u>] to the character on the battlefield.	20342	Assets/Product/Texture/Image/IconToolsSp/EKeyaI03001Sp.png	['Acceleration']	"[""· Upon dealing damage to slowed enemies, reduces all members' QTE cooldown by <color=#4a70b9>1</color>s.""]"		3	2		· Upon QTE entrance, grants [<u>Acceleration</u>] to the character on the battlefield.		21342	· Upon QTE entrance, grants [<u>Hyper Acceleration</u>] to the character on the battlefield.	· Upon QTE entrance, grants [<u>Hyper Acceleration</u>] to the character on the battlefield.	['Hyper Acceleration']	"[""· Upon dealing damage to slowed enemies, reduces all members' QTE cooldown by <color=#17f5cf>1</color>s.\\n· Upon dealing damage, inflicts Elemental DMG equal to ATK x<color=#17f5cf>(difference between character's and enemy's movement speed x10)%</color> (same element as the bearer's).""]"	
