Id	Type	UiType	Name	Icon	Text	PrefabPath	Duration	IsMask	MaskTarget	ClickKey	Params
969924928	1	1	Davis	500131	Though... I hear her blessing for you is special. Don't go wasting it, alright?		0				{1: '1'}
969924929	3	1	Bianca		Lily seeds? I was just about to fetch them... It seems the heavens have aligned our thoughts.		7				
969924930	3	1	Bianca		Father Snow has brought back some lily seeds. While I prepare, might I ask you to fetch them for me?		7				
969924931	3	1	Bianca		Let us begin, then.		3				
969924932	3	1	Bianca		It's a bit early in the year, but it's already warm enough for the flowers to bloom.		5				
969924933	3	1	Bianca		Bonnie told me your injuries haven't fully healed.		3				
969924934	3	1	Bianca		Here, give me your hands and close your eyes.		5				
969924935	3	1	Bianca		O Heavenly Father, may You send gentle winds to smooth the folds of suffering and soft snow to fill the trenches of our scars...		10				
969924945	3	1	Bianca		Even if Your gaze can only watch over living souls, may the threads bind their pain to my palms...		10				
969924949	3	1	Bianca		Let 【kuroname】's blood share warmth with mine, and let 【kuroname】's heart beat with the same warmth as mine.		7				
969924936	3	1	Bianca		...I've already checked. You seem perfectly healthy now. Is there really anything wrong?		6				
969924937	3	1	Bianca		You aren't actually ill, are you?		3				
969924938	3	1	Bianca		You... and Bonnie...		4				
969924939	3	1	Bianca		...You know that the Snowfields haven't been peaceful this year, right?		6				
969924940	3	1	Bianca		"Monsters crawled out from the ""Abyss"" and attacked the towns. Then the plague broke out... and blizzards raged for over a month."		3				
969924941	3	1	Bianca		Only at the summit of the mountain can my prayers reach the divine most clearly.		3				
969924942	3	1	Bianca		I'd stay with you if I could... but my prayers at the summit are for the sake of all, including you.		3				
969924943	3	1	Bianca		I'm touched that you worry for me... but this is my sacred duty.		3				
969924944	3	1	Bianca		Well... how about this?		3				
969924950	3	1	Bianca		No matter where you are, I will always protect you. Even when I'm not by your side, my prayers will bless you, Commandant.		11				
969924946	1	1	【kuroname】		I see.		0				
969924947	1	1	【kuroname】		What did you say?		0				
969924948	1	1	【kuroname】		How are you feeling?		0				
969924951	8			Assets/Product/Texture/Image/UiFight/PanelFightCompleteTip02.png	Lily Seed x1		2				
103601231	3	1	Liv		You shouldn't have left that child to her own devices...		3				
103601232	3	1	Meli		But what else... could I have done?		3				
103601233	3	1	Meli		I couldn't give her love like a human could. So I gave her everything else she asked for... including you, and that human.		10				
103601234	3	1	Liv		She's drawing energy from the minerals... We have to stop her!		4				
103601235	3	1	Meli		It's useless...		3				
103601236	3	1	Liv		I can see your love for her. But I... I have someone I must protect too.		5				
103601237	3	1	Liv		Wake up, Melinoe...		3				
103601211	3	1	Liv		Let's move out, Commandant.		3				
103601212	3	1	Liv		Huff... Feeling rested? Then let's go.		4				
103601213	3	1	Liv		Hmm? A recording device... looks like the Rodent Squad left it behind.		6				
103601214	3	1	Flayo		This is Flayo of the Rodent Squad. We're clearing the mine when we stumbled on a hidden lab inside...		6				
103601215	3	1	Liv		That noise drew too many monsters. If we rush in now, the mine could collapse...		6				
103601216	3	1	Liv		Are those the crane controls on that platform?		3				
103601217	3	1	Liv		Down below... is that a new tunnel entrance?		3				
103601218	3	1	Liv		Let's go check it out, Commandant.		3				
103601219	3	1	Liv		Commandant, there's another crane and some rocks here...		3				
1036012110	3	1	Liv		...There's a hollow space beneath us. We might be able to clear a path with the crane, like before.		7				
1036012111	3	1	Liv		This crane isn't fully powered. There must be more switches around here. Let's look for them, Commandant.		7.5				
1036012112	3	1	Liv		...Drones... Still following their original programs? Where are they headed?		3				
1036012113	3	1	Liv		These vehicles are still operational... We can use them to reach the lab ahead.		4				
1036012114	3	1	Liv		A new supply crate!		2				
1036012115	3	1	Liv		There's a camp up ahead, Commandant. Let's rest a bit.		3				
1036012116	3	1	Liv		Commandant... what kind of research do you think they did here?		6				
1036012117	3	1	Liv		The Rodent Squad... I've only ever heard the name. Never had the chance to work with them myself.		6				
1036012118	3	1	Liv		There are hover platforms over there... We can use them to reach the platform with the vehicles.		15				
1036012119	3	1	Liv		There's the entrance! With the hover platforms, we can get to the vehicle platform next.		6				
1036012120	3	1	Liv		This vehicle will take us to the next area.		3				
1036012121	3	1	Liv		Ugh... Who's there?! Commandant, watch out!		3				
1036012122	3	1	???		(Maniacal laughter)		3				
1036012123	3	1	Liv		Commandant! You're safe... thank goodness.		3				
1036012124	3	1	Flayo		This place... the magnetic field here forms a strange cycle...		6				
1036012125	3	1	Flayo		We've tested it many times and learned the pattern...		4				
1036012126	3	1	Flayo		If you spot an anomaly, turn back. If not, keep going. Do it right eight times, and you'll get through.		8				
1036012127	3	1	Liv		A strange cycle... Commandant, let's move ahead and test it.		4				
1036012128	3	1	Liv		"The magnetic field is distorted... we're back where we started. Did we miss an ""anomaly"" just now?"		6				
1036012129	3	1	Liv		What is this...! A mechanoid... child?!		4				
1036012130	3	1	Liv		We made it out... This should be the end of the mine.		5				
1036012131	1	1			(Several scratches, like those left by metal limbs scraping across rock, mark one wall.)		0				{1: '1'}
1036012132	1	1			(It looks like a small mechanoid child, carefully maintained. The frame is clean and tidy but must have fallen, breaking its core beyond repair.)		0				{1: '1'}
18023	5	1				Assets/Product/Ui/UiFightPrefab/UiFightMovieTalkNew/PanelFightMovieFreeV400.prefab	2				
18024	5	1				Assets/Product/Ui/UiFightPrefab/UiFightMovieTalkNew/PanelFightMovieFreeV400Speical.prefab	2				
1036012133	3	1	Meli		(Gasps in pain)		5				
1036012134	3	1	Meli		Still falling for it, Liv?		3				
1036012135	3	1	Meli		Took the bait again.		2				
1036012136	3	1	Meli		Still holding back? How kind of you...		6				
1036012137	3	1	Meli		I'm no fighter... She'll take you on.		6				
1036012138	3	1	Meli		Not enough power... but time is on our side.		7				
1036012139	3	1	Meli		No... not yet...		12				
1036012140	3	1	Meli		You'll hurt her only over my dead body!		7				
1036012141	3	1	Meli		...Hesitating, Liv?		3				
1036012142	3	1	Meli		I see your sorrow. I hear your pain.		5				
1036012143	3	1	Meli		Let it go. Stay here with me.		2				
1036012144	3	1	Meli		Geez...		2				
1036012145	3	1	Meli		Done hiding?		2				
1036012146	3	1	Meli		Hear their screams...		2				
1036012147	3	1	Meli		Very well.		2				
1036012148	3	1	Meli		Where can you run?		2				
1036012149	3	1	Meli		Watch yourself.		2				
1036012150	3	1	Meli		It's not over.		3				
1036012151	3	1	Meli		Bind, die.		3				
1036012152	3	1	Meli		Pain will consume all...		4				
1036012153	3	1	Meli		Need more... time...		6				
