Id	Name	TradeName	LogName	EnName	Type	Sex	StoryChapterId	Intro	ItemId	LevelUpTemplateId	Priority	EquipType	EquipId	EmotionIcon	Foreshow	DefaultNpcFashtionId	CaptainSkillId	MissionInfo	NeedFirstShow	Code	Element	ShowTimeId	LinkageType	GeneralSkillIds	IsAddGeneral	GeneralElement	Career
1131004	Vera	Geiravor	Vera: Geiravor	Vera	1	1	1	"A test frame developed by Kurono. It failed the berserk test after activation and was abandoned during a mission. Years later, Vera reactivated the frame, seized its control after fierce combats and chaos, and named it ""Geiravor""."	581	1	2470	54	2544001	Assets/Product/Texture/Image/IconType/IconCharacter2.png		6005001	113422	Unnamed		BPN-13	2			[6]			5
1351003	Vergil	Vergil	Vergil	Vergil	1	2	1	A legendary devil swordsman who masters lightning-fast quick-draw techniques. The elder twin of Dante.	582	1	2480	55	2555001	Assets/Product/Texture/Image/IconType/IconCharacter3.png		6005101	135322	Unnamed		Vergil	1		1	[3]			1
1361003	Dante	Dante	Dante	Dante	1	2	1	The boss of Devil May Cry, and the most powerful devil hunter alive. Revered for his legendary strength.	583	1	2490	56	2565001	Assets/Product/Texture/Image/IconType/IconCharacter3.png		6005201	136322	Unnamed		Dante	2		1	[2]			1
1041005	Bianca	Crepuscule	Bianca: Crepuscule	Bianca	1	1	1	This is a new specialized frame developed by the Science Council, based on further validation of the Phantom Tracer. It can disrupt Punishing information to some extent, effectively weakening its influence.	584	1	2500	57	2574001	Assets/Product/Texture/Image/IconType/IconCharacter3.png		6005301	104522	Unnamed		BPO-87	5			[7]			1
1371002	Discord	Secator	Discord: Secator	Discord	1	1	1	A new frame designed by Babylonia. Compared to Kurono's older model, its M.I.N.D. is less stable, with output levels prone to wide fluctuations.	585	1	2510	58	2584001	Assets/Product/Texture/Image/IconType/IconCharacter3.png		6005401	137222	Unnamed		BPN-49	1			[3]			1
1381003	Veronica	Aegis	Veronica: Aegis	Veronica	1	1	1	A former member of the Church of Machina, who left the organization for various reasons and now operates independently. Prefers expressing herself through force rather than words.	586	1	2520	59	2594001	Assets/Product/Texture/Image/IconType/IconCharacter3.png		6005501	138322	Unnamed		MPK-01	1			[2]			5
1031005	Liv	Limpidity	Liv: Limpidity	Liv	1	1	1	Developed by the Science Council, this new frame integrates data from the Golden Age's Phylotree of Ousia project into the M.I.N.D. Its success marks the dawn of a new era.	587	1	2530	60	2604001	Assets/Product/Texture/Image/IconType/IconCharacter3.png		6005601	103522	Unnamed		BPN-08	4			[6]			1
