Id	Pos	PrePlaceId	Name	Desc	CanGetPeople	ResourceId	UnlockCondition	EventId	StageId
10101	1		Urban Area A						
10102	5		Burning Ruins	The fire on the ruins is still burning even until this moment. We can only pray for the fire to show us some mercy and leave something that we can still use...		[1, 2]		[101020]	
10103	3	10102	Empty Library	It's more realistic to look for books to burn than food to eat in this place.		[1, 2]		[101030]	
10104	7	10103	Riverside Camp	There is smoke rising from the stones. Could it be the Corrupted? Or the campfire made by survivors?		[3, 4]		[101040]	
10105	20	10103	Run-Down Slum	I can hear people crying even from the outside. I'm afraid the situation is worse than we expected... Should we accept them? Or put an end to their misery...?	True	[3, 4]		[101050]	
10106	6	10102	Crowded Street	There are burns on every car on this crowded street. Apparently, their owners didn't have the chance to drive them out of the city.		[1, 2]		[101060]	
10107	11	10106	Quiet Bomb Shelter	It's hard to imagine how this bomb shelter has survived everything. However, we could find something we need here...		[1, 2]		[101070]	
10108	14	10107	Collapsed Skyscraper	The ruins look like the corpse of a giant. No matter what's in there, it will definitely not be pleasant.	True	[3, 4]		[101080]	
10201	1		Urban Area B						
10202	6		Signal Station	Recently, we have found the signal tower under the ruins. But the huge signal tower now only has a fragile, damaged base left standing in the center of the city.		[1, 2]		[102020]	
10203	5	10202	High-End Residential Area	Despite the broken columns at the entrance, the delicate architecture still looks amazing. If it hadn't been the disaster, it would have been a dream come true to live there.		[1, 2]		[102030]	
10204	3	10203	Fine Dining Restaurant	It's said that it was a popular fine dining restaurant, famous for its huge number of underground cold storage rooms and its wide range of food in store.		[1, 2, 3, 4]		[102040]	
10205	20	10203	Two-Story House	This small building looks almost intact. It's just that sometimes there are strange cries coming out from it. Are there any Scavengers in there? Or it is another trap?		[1, 2]		[102050]	
10206	7	10204	Quiet Cabin	There is still a faint light coming out from this clean little cabin, making it stand out among the black ruins around it.	True	[1, 2]		[102060]	
10207	19	10206	Convenience Store Ruins	It offers fewer choices of items than a supermarket but is enough to fulfill your daily needs.		[1, 2]		[102070]	
10208	24	10207	Bloody Church	There is blood and unidentified remains everywhere. Wait. Did you hear that? Was it the bells... from up there...?	True	[3, 4]		[102080]	
10209	12	10202	Supermarket in Mist	Is it because of the terrain? This place is full of mist. Hope we can find the supermarket marked on the map before using up our supplies.		[1, 2]		[102090]	
10210	9	10209	Collapsed School	The disaster didn't show mercy to this place even though there was the hope of the inheritance of human civilization behind that wall. This is a fact that we learned a long time ago.		[1, 2]		[102100]	
10211	14	10209	Wasteland	The Punishing Virus broke out before any construction plan was able to be carried out here.		[1, 2]		[102110]	
10212	11	10211	City Hospital	"Were it not for the bold characters on the map, no one would know that this black burnt ""pile of dirt"""" used to be a """"hospital."""	True	[3, 4]		[102120]	
10213	4		Rocky Riverbank	The river has long dried out. There is smoke rising from the rocks. Could it be the Corrupted? Or the campfire made by Scavengers?		[1, 2]	[102130]	[102130]	
10214	10	10213	Suburban Farm	It seems the farm didn't survive the disaster even though it locates far from the city. Nevertheless, it's still a precious location for us to stay.		[1, 2]		[102140]	
10301	1		Urban Area C						
10302	5		Traveler's Cabin	This is the only intact building we see walking along the road. We can still see a faint light in it through the window. Could there still be Scavengers in there?		[3, 4]		[103020]	
10303	4		Roadside Gas Station	Apart from the convenience store that was broken open violently, this roadside gas station still remains how it looked when just abandoned.		[3, 4]		[103030]	
10304	3	10302	Industrial Park	There is a giant toy statue at the entrance to the park. Half of its face was blown off, leaving only half of its huge smile on the face.		[3, 4]		[103040]	
10305	6	10302	Abandoned Market	The degree of damage to the market makes me wonder if it was already abandoned before the disaster. Hope we can find something useful in it.		[3, 4]		[103050]	
10306	10	10303	Abandoned Port	The ships stranded on the shore have formed a natural fortress, making me wonder if there are any remaining supplies or Scavengers in the ship cabins.		[1, 2]		[103060]	
10307	13	10303	Quiet Bomb Shelter	It's hard to imagine how this bomb shelter has survived everything. However, we could find something we need here.		[1, 2]		[103070]	
10308	7	10304	Collapsed Mansion	"A mansion with astonishing design and size. If it hadn't been the disaster, it would have been the place for most of the ""upper class"" to hang out on weekends."		[1, 2]		[103080]	
10309	21	10304	Golden Farm	In the past, the farm was known for its high yield of rice and the golden rice field during harvest. Even now, we can still see the golden light of the farm under the sun from afar.	True	[3, 4]		[103090]	
10310	16	10306	Armed Dwelling	It's said that there are a group of armed Scavengers with sufficient supplies here... Hope I can negotiate with them and get us some supplies. However, if things go sideways... I think I'd better bring a weapon with me...	True	[3, 4]		[103100]	
10311	11	10307	Empty Trench	The air is full of the bad smell of burnt bodies. Fortunately, we didn't find any traces of the Corrupted around here. I thought I was already used to the smell of death, but I still feel like throwing up standing here...		[1, 2]		[103110]	
10312	18	10307	Forest Valley	The ruts full of water stretch all the way into the valley. After observation, we find traces of tents in the woods. Perhaps we can find some Scavengers here.		[1, 2]		[103120]	
10313	19	10308	Abandoned Mine	The complex structure of the tunnels provides a good shelter for the Scavengers. However, even the thick stone walls can't stop the burnt smell of flesh from coming out. It won't look good in there. Should we still go in there?		[1, 2]		[103130]	
10314	8		Riverside Camp	"It seems the river has dried out a long time ago. The black ""corpses"" of the burnt trees have created a natural wall for this place, making it hard for us to see what is going on in the camp. Maybe we should take a closer look."	True	[3, 4]	[103140]	[103140]	
10315	15		Orchard	This place used to be a productive orchard with rivers full of fish floating through. Now there are only broken, bare, burnt branches... Is it possible to find any supplies or Scavengers here?		[3, 4]	[103150]	[103150]	
10316	15		Orchard	This place used to be a productive orchard with rivers full of fish floating through. Now there are only broken, bare, burnt branches... Is it possible to find any supplies or Scavengers here?		[3, 4]	[103160]	[103160]	
10401	1		Area D						
10402	5		Empty Trench	The air is full of the bad smell of burnt bodies. Fortunately, we didn't find any traces of the Corrupted around here. I thought I was already used to the smell of death, but I still feel like throwing up standing here...		[1, 2]		[104020]	
10403	4		Crowded Street	There are burns on every car on this crowded street. Apparently, their owners didn't have the chance to drive them out of the city.		[1, 2]		[104030]	
10404	3	10402	Camp Amidst Woods	From the outside, the camp seems to be well stocked with supplies. Maybe there are survivors. Even if they don't want to join us, at least we can try if we can get some food or other resources from them.		[1, 2]		[104040]	
10405	6	10402	Supermarket	Most of the windows have lost their glass. It looks like this place has been bombarded or ransacked by other Scavengers, or both. We can only imagine what the place looked like with the broken sign left here.		[3, 4]		[104050]	
10406	8	10402	Bloody Church	There is blood and unidentified remains everywhere. Wait. Did you hear that? Was it the bells... from up there...?		[1, 2]		[104060]	
10407	7	10404	Cabin Amidst Woods	The creaks of the broken door can scare people off even in the broad daylight.		[3, 4]		[104070]	
10408	21	10404	Quiet Bomb Shelter	It's hard to imagine how this bomb shelter has survived everything. However, we could find something we need here.	True	[3, 4]		[104080]	
10409	20	10404	Small Fishery	The fishery is just a simple shanty plus some broken fishing nets. We may still find something useful if we are lucky.		[3, 4]		[104090]	
10410	12	10405	Dilapidated Building	The building is a bit shaky in the winter. Should we still go in there?	True	[3, 4]		[104100]	
10411	10	10403	Run-Down Slum	I can hear people crying even from the outside. I'm afraid the situation is worse than we expected... Should we accept them? Or put an end to their misery...?	True	[3, 4]		[104110]	
10412	17	10403	Empty Library	It's more realistic to look for books to burn than food to eat in this place.		[3, 4]		[104120]	
10501	1		Urban Area E						
10502	5		Overlook Point	We could have a bird's eye view of the city if we reach that spot up there.				[105020]	
10503	6	10502	Lab Building	The building is like the second landmark of the city. You can see it from anywhere in the city without going to the overlook point. However, there is a strange defensive line before the building. No one is guarding there anymore.				[105030]	
10504	4	10502	Armed Dwelling	My friends tell me that there are a group of armed Scavengers with sufficient supplies here... Hope I can negotiate with them and get us some supplies. However, if things go sideways... I think I'd better bring a weapon with me...				[105040]	
10505	3	10502	Radio Station	The radio station is also a mess, but we could find some useful information here.				[105050]	
10506	12	10503	Strange Opening	There is a big hole in the ground. I can smell gasoline and a fishy odor when standing close to it. When I look into the hole, it looks like a huge bottomless abyss that has been holding the secret behind the destruction of the conservation area.				[105060]	
10507	20	10503	Quarantine Area	There is a biohazard sign at the entrance to the quarantine area. Everything inside seems to be ruined. Could we find anything useful in a place like this?				[105070]	
10508	14	10506	Underground Lab	What appears before us is a giant lab. No matter who created this place, that person must be supported by a powerful organization.				[105080]	
10509	11	10508	Hidden Room	This metal wall in the lab is full of scratches. It sounds weird when we knock on the wall. There must be a hidden space behind it.				[105090]	
10510	13	10509	Outer City	Behind the lab is a channel leading to the outside of the city. The faint light at the end of the tunnel tells us that the dark night of the city will pass soon.				[105100]	
10511	7	10505	Residential Area	The density of buildings here suggests that it was a busy area, but now there is only dead silence.				[105110]	
10512	8	10511	Supermarket in Mist	Is it because of the terrain? This place is full of mist. Hope we can find the supermarket marked on the map before using up our supplies.				[105120]	
20100	1		Exercise Camp	A small camp set up for the survival exercise. It has reproduced the living environment of the Scavengers on the ground to the maximum extent.	True				
20101	2	20100	Quiet Apartment	Even though most of the paint has come off the walls and revealed the bloody red bricks, the building still remains in good shape. Hope there is something we can use inside it.		[1, 2]		[2010100]	
20102	3	20101	Camp Amidst Woods	If it were not for the flash of light at night, we wouldn't have found this camp. It's well hidden. In other words, it's a perfect shelter.	True	[1, 2]		[2010200]	
20103	4	20102	Roadside Gas Station	From the outside, the roadside gas station still looks abandoned. Even the door of the convenience store deep inside is closed. Everything is peaceful and quiet.	True	[4]		[2010300]	
20104	5	20103	Wastewater Treatment Plant	"This distorted building is the Golden Age wastewater treatment plant marked on the map. However, it is the only building that still looks like a ""building"" in the area."	True	[1, 2]		[2010400]	
20105	6	20104	Suburban Quarantine Station	The quarantine station is located far away from the city center, which is probably the reason why it is still in a good state. There are ruts left by survivors outside the station. We could find plenty of useful things if we are lucky.	True	[3, 4]		[2010500]	
20106	7	20102	Resource Landfill Site	"... Compared to the weird Red Tide and the smell of blood, the smell of this landfill site is rather ""pleasant"". It could hold some useful supplies. A place worth exploring."	True	[2]		[2010600]	
20107	8	20101	Empty Trench	We can smell gunpowder even from a distance. Thankfully, we haven't seen any traces of the Corrupted around here. Should we take a look?	True	[1, 2, 3, 4]		[2010700]	
20108	9	20107	Battlefield Ruins	One can still see a pile of the remains of the Corrupted in the center of the battlefield even from a distance. In other words, if it is safe enough, it must hold many usable supplies.		[1, 2]		[2010800]	
20109	10	20100	Community Hospital	There is dim light coming out through the windows. Are the Scavengers who escaped from the forest camp staying here?	True	[1, 2, 3, 4]	[20109]	[2010900]	
20110	11	20109	Suburban Signal Station	The huge signal station only has its damaged base remaining, which looks like a giant's body with its upper half missing. It stands vulnerably and firmly in the wilderness.	True	[1, 2]		[2011000]	
20111	12	20110	Southern Woods	From the outside, we can see the wet ruts extending deep into the forest. Perhaps we can find some survivors by following the ruts.	True	[1, 2]		[2011100]	
20200	1		Camp	A temporary camp. The exploration team needs to return to the camp to recycle the resources in the backpack.					
20201	2	20200	Abandoned Postal Station		True	[1, 2, 3, 4]		[2020100]	
20202	3	20200	Mountain Village		True	[1, 2, 3, 4]		[2020200]	
20203	4	20202	Cableway			[1, 2]	[20203]	[2020300]	
20204	5	20203	Relatively Flat Mountain Road			[1, 2, 4]		[2020400]	
20205	6	20204	Mountaintop Viewpoint		True	[1, 2, 3, 4]		[2020500]	
20206	7	20205	Cliff Lake		True			[2020600]	
20207	8	20206	Mountain Valley		True			[2020700, 2020710, 2020720]	
20208	9	20207	Southern Evacuation Point		True			[2020800]	
20209	10	20201	Resource Transfer Depot		True	[3, 4]		[2020900]	
20210	11	20209	Eastern Resource Depot		True	[3, 4]		[2021000]	
20211	12	20200	Path of Fallen Leaves			[1]		[2021100]	
20212	13	20211	Forest Edge			[1, 2]	[20212]	[2021210, 2021220]	
20213	14	20212	Burnt Forest			[1, 2, 4]		[2021310, 2021320]	
20214	15	20213	Dark Path	The forest seems to be boundless as if it's sending... a silent invitation.	True			[2021410, 2021420, 2021430]	
20215	16	20214	Hunting Trap		True	[1, 2, 4]		[2021510, 2021520, 2021530]	
20216	17	20213	Hunter's Cabin		True	[1, 2, 3, 4]		[2021600]	
20217	18	20211	Rocky Riverbank		True	[1, 2]		[2021700]	
20218	19	20217	Lumberjack's Cabin		True	[1, 2]		[2021800]	
20219	20	20218	Old Logging Site		True	[1, 2]		[2021900]	
20300	7		Camp						
20301	8	20300	Temporary Shelter	This temporary shelter is actually a huge, tattered tent, inside which live many emaciated refugees.	True	[3, 4]		[203010]	
20302	1	20300	Flat Area	This is a barren land with cement fragments scattered on it.				[203020]	
20303	13	20300	Abandoned Hospital	An abandoned hospital without electricity. Looking from the outside, the hospital is just as creepy as the typical haunted hospital in the movie.		[3, 4]		[203030]	
20304	9	20301	Forest Edge	This is a dense forest that the wind could hardly blow through. It's dark deep in the forest. And there seem to be howls of beasts coming from it.		[1, 2, 3, 4]		[203040]	
20305	2	20302	Abandoned Gas Station	An abandoned gas station. It's old, but its staff room can still be used as a shelter.		[1, 2, 3, 4]		[203050]	
20306	3	20305	Abandoned Road	Long in disrepair, the road is bumpy and covered in bird droppings.				[203060]	
20307	4	20306	Abandoned Farm	An abandoned farm. Judging from the situation inside it, a family of seven used to live here.			[20312]	[203070]	
20308	5	20307	Giant Wheel	A huge mechanical device that gives off a ghostly silver metallic light. Its core is rotating at a tremendous speed with a roaring sound.	True	[1, 2]		[203080]	
20309	14	20303	Abandoned School	An abandoned school that looks good. A perfect shelter from wind and rain.	True			[203090]	
20400	3		Camp						
20401	18	20400	Ruins	This place used to be a large amusement park full of the laughter of the children. The war turned this land of happiness into ruins.				[204010]	
20402	1	20401	Highway 68	A chemical plant was blown up in the war, leaving heavy pollution in the air and water nearby. We have to wear masks to proceed in the toxic mist here.				[204020]	
20403	23	20406	City Outskirts	There are many supplies scattered around on the ground of the city outskirts. They must be left by people who fled the war in a hurry. Where are they right now?		[3, 4]		[204030]	
20404	20	20403	City Entrance	Even though the city has gone through the war and is severely damaged, this extravagant building is still standing in the city center. Disgusting.				[204040]	
20405	21	20404	City Center	It is where everything started. Expose the evil with your hands and end this absurd drama.				[204050, 204052]	
20406	19	20402	Church	A church that was blown up by bombs. It used to be the place where people make prayers. God, will you save humans today?				[204060]	
20407	2	20400	Dilapidated Building	A building that has gone through the war. It could be a watchtower but is already hard to recognize its original form. The walls are full of bullet holes, revealing some of the steel bars, as if the building is about to collapse at any minute.				[204070]	
20408	9	20407	Hillside Villa	A small hill with a relatively complete big house on the hillside. It could be the private villa of a rich family. Shhh. It seems there is someone in the villa. Let's get closer.		[1, 2]		[204080]	
20500	1		Camp	A secondary island located relatively far away from the Hexagon Island.					
20502	2	20500	Smart Gate One	The first gate of the Hexagon Island. It used to be the place where Scavengers' intelligence got tested before the island was sealed off.	True	[1, 2, 3, 4]		[2050200, 2050206]	
20503	3	20502	Survival Gate Two	The second gate of the Hexagon Island. It used to be the place where Scavengers' survival skills got tested before the island was sealed off.		[1, 2, 3, 4]		[2050300, 2050304, 2050306, 2050308]	
20504	4	20503	Strength Gate Three	The third gate of the Hexagon Island. It used to be the place where Scavengers' strength got tested before the island was sealed off.		[3, 4]	[20504]	[2050400, 2050404, 2050406, 2050408]	
20505	5	20503	Honor Island	An island of honor for Scavengers who passed all six trials. The towering alloy pillar in the middle is carved with the name of the Hexagon Warriors in the order of time. Will your name appear where the pillar touches the sky?		[3, 4]		[2050500]	
20506	6	20503	Cultivation Area	The area that produces most of the food for the islanders. It is also where the Scavengers exchange supplies.	True	[3, 4]		[2050600]	
20507	7	20504	War Gate Four	The fourth gate of the Hexagon Island. It used to be the place where Scavengers' combat capabilities got tested before the island was sealed off.		[3, 4]	[20507]	[2050700, 2050704, 2050706, 2050708]	
20508	8	20504	Unnamed Island	An island that is only halfway developed and now surrounded by warning lines. The rusty gate at its entrance is quietly closed.				[2050800, 2050803, 2050805]	
20509	9	20504	Fresh Water Treatment Area	An advanced water treatment device that provides fresh water for the island.		[3, 4]		[2050900, 2050902]	
20510	10	20509	Comms Depot	A base that sends and receives signals. It was destroyed after the island was sealed and still hasn't been repaired up to this day.		[3, 4]		[2051000, 2051002, 2051004]	
20511	11	20507	Defense Gate Five	The fifth gate of the Hexagon Island. It used to be the place where Scavengers' defense capabilities got tested before the island was sealed off.		[3, 4]	[20511]	[2051100]	
20512	12	20507	Medical Depot	The place where the island distributes serum and heals patients. It is also where Beverly works.		[3, 4]		[2051200, 2051203, 2051205]	
20513	13	20512	Residential Area	It is where the islanders live. Hexagon Warriors live in the most luxurious places in this area.		[3, 4]		[2051300, 2051305]	
20514	14	20512	Warehouse	It holds many emergency supplies. Only the island chief can enter.		[3, 4]		[2051400, 2051403]	
20515	15	20513	Residence of the Island Chief	It is where the island chief's family lives and where they meet guests. It's said that among the island chief's family members, there is an outsider who passed the Hexagon trials.		[3, 4]		[2051500, 2051503]	
20516	16	20511	Mechanical Gate Six	The sixth gate of the Hexagon Island. It used to be the place where Scavengers' mastery of various weapons got tested before the island was sealed off.			[20516]	[2051600, 2051604, 2051608]	
20517	17	20511	Shipwreck Point	A luxury ship sank here 3 years ago.				[2051700]	
20518	18	20516	Fishery	It's a fishery and an open fishing pool. There are many assault boats here.				[2051800, 2051803, 2051805]	
20600	1		Camp	A temporary camp. The exploration team needs to return to the camp to recycle the resources in the backpack.	True				
20601	2	20600	Roadside Cabin	The only building that is relatively complete by the roadside. There is occasionally smoke coming out of the chimney. Are there any Scavengers inside?	True	[1, 2]		[2060100]	
20602	3	20601	Mangshan Pass	The only entrance to Mangshan. One can see the outline of the misty Mangshan from here.		[1, 2]		[2060200]	
20603	4	20602	Hiking Trail	It's more like a relatively flat mountain road than a hiking trail. It's a detour to enter the mountain.	True	[1, 2]	[206030]	[2060300]	
20604	5	20603	Mountain Farm	A farm on the hillside. It seems it was famous in the area due to its high yield of corn.	True	[4, 1, 2]		[2060400]	
20605	6	20604	Collapsed Road	A path found with the military facility map. It's barely passable.	True	[3, 4, 1, 2]	[206050]	[2060510]	
20606	7	20605	Medical Camp	A medical camp set up by survivors after the Mangshan battle.	True			[2060610, 2060620, 2060630]	
20607	8	20606	Mangshan Entrance	The last checkpoint outside the Mangshan Camp.	True			[2060700]	
20608	9	20607	Mangshan Camp	Jersey's hometown.	True			[2060810, 2060820, 2060830]	
20609	10	20606	Signal Station	It shows that there are medicine, food, wood, iron, and survivors.	True		[206090]	[2060910]	
20610	11	20603	West Mountain Road	"This is a road that links the Health Center, the Military Facility, and Mangshan Pass. Originally nameless, it was named the ""West Mountain Road"" as it is located on the west of the mountain."	True	[3, 4]		[2061000]	
20611	12	20610	Health Center	A health center established in the Golden Age. It is still operating in a difficult state. It's the medicine hub of the surrounding area.	True	[3, 4]	[206110]	[2061100]	
20612	13	20611	Warship Remains	No one knows how long the warship remains have been here.	True	[2]		[2061200]	
20613	14	20612	Military Facility	A military facility that emits strange signals. The Corrupted nearby are probably attracted here by it.	True	[2]		[2061310, 2061320]	
20614	15	20611	Transfer Station	A transfer station of the old times. It was still the main transportation hub not long ago.		[3, 4]		[2061400]	
20615	16	20601	Abandoned Hotel	A hotel near the mountain. The location is perfect, but the hotel itself is already abandoned.		[4, 2]		[2061500]	
20616	17	20615	Temporary Camp	A temporary camp built as a shelter from the mountain wind. It's just a place to temporarily take a rest.		[3, 4, 1]		[2061600]	
20617	18	20600	Deep Pit	A huge pit that cuts off the road to the west.		[3]	[206170]	[2061700]	
20618	19	20600	Dongshan Racecourse	A famous racecourse in the Golden Age. It has already been abandoned for years.		[3, 4, 1, 2]	[206180]	[2061800]	
20619	20	20618	Grassland of Horses	A place for the racecourse horses to rest. The golf course seems to be ahead.		[3, 4]	[206190]	[2061900]	
20620	21	20619	Golf Course	"A golf course with astonishing design and size. If it hadn't been the disaster, it would have been the place for most of the ""upper class"" to hang out on weekends."		[3, 4]		[2062000]	
20621	22	20600	Forest Park	A forest park on the edge of the city. There is even a supermarket in it. We could probably find some supplies here.		[3, 4, 1, 2]	[206210]	[2062100]	
20622	23	20621	Park Supermarket	It offers fewer choices of items than a supermarket but is enough to fulfill your daily needs.		[3, 4]		[2062200]	
20623	24	20622	Park Management Office	The management office of the park. There seems to be light coming out from the office. Perhaps there are survivors inside.		[3, 4]		[2062300]	
20625	26	20622	Black Lighthouse	A black lighthouse that stands quietly by the lake.		[3, 4]		[2062500]	
20626	27	20625	Lakeside Cave	A weird cave. There seem to be traces left by a tent deep inside.		[3, 4]		[2062600]	
20627	28	20600	Abandoned Industrial Park	The previous big industrial park is now in ruins.	True	[1, 2]	[206270]	[2062700]	
20628	29	20627	Freight Station	A freight station of the old times. There could be other supplies in the warehouse.	True	[3, 4, 2]		[2062800]	
