Id	Name	CharacterId	RobotId	FightEventIds	BuffConditions	CharacterTitles	CharacterDesc	BuffIcons	BuffNames	BuffDesc
1	Bianca: Stigmata	1041004	171002	[2265101, 2265102]	[774800, 1046903]	['Burst', 'Sharp Reserve']	['Deliver burst DMG based on the accumulated Truewill.', 'Basic Attack and 3-Ping fill up the Sharp Reserve.']	['Assets/Product/Texture/Image/IconAffix/AffixIconNewMod2001.png', 'Assets/Product/Texture/Image/IconAffix/AffixIconBodong.png']	['Oathlight Refraction', 'Radiant Resonance']	['When casting Sword Dance, each time the swordwaves damage enemies, it triggers Ultima Slash if the Sharp Reserve allows.', 'Consume all remaining Ultima (up to 30) to deal an additional Ultima Slash DMG equal to Ultima x200% when you cast the Phase 2 Signature [Illuminated Abyss].']
2	Hanying: Solacetune	1241003	171001	[2265103, 2265104]	[1046901, 1046904]	['Looping Circle']	['Ultima Slash can be released quickly and repeatedly to accumulate Truewill.']	['Assets/Product/Texture/Image/IconAffix/AffixIconTongling.png', 'Assets/Product/Texture/Image/IconAffix/IconAffixDuyuUp.png']	"[""Butterfly's Waltz"", 'Harmonic Legato']"	['The Sharp Reserve fills up 100% faster.', 'Each time Ultima Slash is cast, the number of slashes triggered by each charge of Ultima Slash is doubled.']
3	Alisa: Echo	1261003	171003	[2265105, 2265106]	[774800, 1046902]	['Buff', 'Sharp Reserve']	['Provides a buff for Ultima Slash and CRIT DMG.', '3-Ping and Cipher Orb fill up the Sharp Reserve.']	['Assets/Product/Texture/Image/IconAffix/AffixIconDudou.png', 'Assets/Product/Texture/Image/IconAffix/AffixIconBudong.png']	['Aegis of Arrows', 'Verdict to Sever Sins']	['QTE fills the Sharp Reserve by 100 points every second for 5s. Each trigger refreshes the duration.', 'Each time Echo activates Core Passive - Judgment Co-Strike, it increases Ultima Slash CRIT DMG by 50%, stacking up to 100%.']
4	Qu: Shukra	1521004	171005	[2265201, 2265202]	[774800, 1046907]	['Burst', 'Glaciation']	['Deals massive extra Glaciation DMG while Ice Spikes are active.', 'Basic Attack and 3-Ping grant Glaciation.']	['Assets/Product/Texture/Image/IconAffix/AffixIconKangbing.png', 'Assets/Product/Texture/Image/IconAffix/AffixIconBingjing.png']	['Stormy Frost', 'Frigid Elegy']	"['While Ice Spikes are active, 3-Ping will trigger Ice Accumulation and deal extra Glaciation DMG.', ""Casting Phase 2 Signature, Sovereign's Presence, while Ice Spikes are active will deal extra Glaciation DMG based on the current Congelation.""]"
5	Wanshi: Lucid Dreamer	1211003	171004	[2265203, 2265204]	[1046905, 1046908]	['Looping Circle']	['Quickly accumulates Arctic Ice Layer and activates Ice Spikes.']	['Assets/Product/Texture/Image/IconAffix/AffixIconYubing.png', 'Assets/Product/Texture/Image/IconAffix/IconAffixBingshuangUp.png']	"[""Snow Owl's Hunt"", 'Submerged in Gloom']"	['The duration of Ice Spikes increases by 12s.', 'Every time you trigger Ice Accumulation, increase the Glaciation DMG you deal by an extra 20% for 5s. This effect can be stacked up to 100%.']
6	No. 21: Feral	1221003	171006	[2265205, 2265206]	[774800, 1046906]	['Buff', 'Glaciation']	['Provides Signal Orb recovery and DMG buffs.', 'Basic Attack and 3-Ping grant Glaciation.']	['Assets/Product/Texture/Image/UiFubenBossSingle/BossSingleIconPowerbing.png', 'Assets/Product/Texture/Image/IconAffix/AffixIconDongjie.png']	['Shadowed Tracker', 'Poised to Act']	['Receive an additional 100 Glaciation Value and +100% Glaciation DMG upon triggering QTE or healing. Cooldown: 5s.', 'QTE or healing grants 2 sets of Signal Orbs to all characters on the field. 5s cooldown.']
