TextId	ActorName	ActorTalk	Cv	Desc
1	Gloomy Customer	...Gray... Gray Raven Commandant... Are you also here... hic... to drown your sorrows?		
2	[PlayerName]	Just here to unwind.		
3	Gloomy Customer	My... my brother says I don't deserve to be a lawyer. He goes on about how lawyers exist to uphold justice, and that I shouldn't be defending people like the Kurono gang.		
4	Gloomy Customer	Who cares about justice? I worked my way up from the mailroom to become a professional lawyer just to earn credits—hic!		
5	[PlayerName]	(He looks completely drunk. Better leave him alone.)		
6		Your brother is right.		
7		Believe in your own judgment.		
