Id	BigImgPath	ObtainElementList	ObtainElementValueList	ObtainSpeicalTitle	ObtainSpeicalDes	AttribGraphDes	AttribGraphNum	DetailDes	CareerIcon	FullBodyImg	LiberationShowType	CharacterPowerId	PowerSkillIds	PowerEnhanceSkillIds	EnableCheckAmplifierAndSameElement
1521004	RoleStory.R4BiankaNormal01	[3]	[100]	['Burst', 'Sustained Damage']	['Deals massive DMG in a short time.', 'Has a certain level of endurance.']		[85, 78, 70, 90, 90, 95]	A frame reforged by Tabula Akasha through life and death even with the Transcendant's Punishing Virus removed. Its principle and structure remain unknown.	RoleStory.R4BiankaNormal01	Assets/Product/Texture/Image/IconChouKaRole/DrawCharacterLucia.png					
1291002	RoleStory.R4BiankaNormal01	[5, 6]	[90, 10]	['Amplification', 'Disruption']	"[""Able to heal and boost allies' Dark DMG."", ""Able to rapidly break the enemy's Equilibrium Field.""]"		[80, 90, 90, 85, 90, 85]	Vice-captain of the Engineering Force. Since she is a programming expert, the core configurations of her frame are geared more toward a technician. However, this doesn't mean that she's not capable of combat—her stage is far beyond the battlefield in the physical world.	RoleStory.R4BiankaNormal01	Assets/Product/Texture/Image/IconChouKaRole/DrawCharacterLucia.png					
1171004	RoleStory.R4BiankaNormal01	[6]	[100]	['Form Switch', 'Disruption']	"['Skills can switch attacking modes.', ""Able to rapidly break the enemy's Equilibrium Field.""]"		[95, 95, 95, 90, 95, 85]	Once an agent of the Ascension-Network, she now seeks to resist, guide, and control the entire Ascension-Network to create an ideal paradise after the Agent Zero incident.	RoleStory.R4BiankaNormal01	Assets/Product/Texture/Image/IconChouKaRole/DrawCharacterLuna1.png					
1301002	RoleStory.R4BiankaNormal01	[2]	[100]	['Resistance Reduction', 'Ignition']	['Able to reduce the Resistance of enemies.', 'Launches the enemy into the Combustible status and Ignites them.']		[80, 90, 90, 85, 90, 85]	A balanced duel-purpose frame capable of both attack and defense that the Science Council specially designed for the Support Force. It carries many special parts with part of its features adjusted accordingly.	RoleStory.R4BiankaNormal01	Assets/Product/Texture/Image/IconChouKaRole/DrawCharacterLucia.png					
1241003	RoleStory.R4BiankaNormal01	[1]	[100]	['Defense Down', 'Ultima Slash']	['Able to reduce Physical Defense of enemies.', 'This skill can unleash the Ultima Slash.']		[85, 80, 85, 85, 85, 85]	This frame, forged by the Church of Machina, is equipped with new hardware while preserving the superior instruction set architecture of Kowloong from the Golden Age. Though fierce in battle, the core of Hanying remains gentle and kind, providing her with the strength to stand firm.	RoleStory.R4BiankaNormal01	Assets/Product/Texture/Image/IconChouKaRole/DrawCharacterLucia.png					
1211003	RoleStory.R4BiankaNormal01	[3]	[100]	['Defense Down', 'Glaciation']	['Able to reduce the Ice Resistance of enemies.', 'This skill can trigger the Glaciation effect.']		[85, 80, 85, 85, 85, 85]	This Tank frame is equipped with an advanced auto-aiming system while retaining some medical devices that are usually exclusive to Support frames. After retrieving all of his memory data, Wanshi has grown into a more complete version of himself. Though the long dream has yet to end, his path forward has already become clear.	RoleStory.R4BiankaNormal01	Assets/Product/Texture/Image/IconChouKaRole/DrawCharacterLucia.png					
1021006	RoleStory.R4BiankaNormal01	[2]	[100]	['Burst', 'Plasma Beam']	['Deals massive DMG in a short time', 'Skills can trigger the Plasma Beam Effect.']		[85, 80, 85, 85, 85, 85]	Developed based on years of research of the Science Council, Pyroath is a new specialized frame carrying the Omega Core with efficient air combat capability. Through countless moments with Gray Raven, Lucia has found her purpose. Now, she's determined and calm just like the fire that forever burns on the frame.	RoleStory.R4BiankaNormal01	Assets/Product/Texture/Image/IconChouKaRole/DrawCharacterLucia.png					
1311002	RoleStory.R4BiankaNormal01	[4]	[100]	['Burst', 'Glaciate']	['Deals massive DMG in a short time', 'Skills can trigger the Glaciation Effect.']		[85, 80, 85, 85, 85, 85]	Following the style of the Yata human era, this unit is specifically designed for extended combat operations. Equipped with high-performance plasma armatures in its arm structure and rear-mounted mechanical arms, it can unleash devastating kinetic energy in an instant.	RoleStory.R4BiankaNormal01	Assets/Product/Texture/Image/IconChouKaRole/DrawCharacterLucia.png					
1051005	RoleStory.R4BiankaNormal01	[4]	[100]	['Resistance Reduction', 'Ignition']	['Able to reduce the Lightning and Fire Resistance of enemies.', 'Launches the enemy into the Combustible status and Ignites them.']		[80, 90, 85, 82, 90, 85]	Designed by Nanami herself, this frame features a deep-space specialized protective coating, allowing her to barely withstand the corrosive surface environment of the Red Tide while also possessing exceptional interstellar navigation capabilities.	RoleStory.R4BiankaNormal01	Assets/Product/Texture/Image/IconChouKaRole/DrawCharacterLucia.png					
1321003	RoleStory.R4BiankaNormal01	[6]	[100]	['Observer', 'Disruption']	"['Character ability changes based on the team formation.', ""Able to rapidly break the enemy's Equilibrium Field.""]"		[90, 90, 90, 90, 90, 90]	Along with the rise and fall of countless civilizations, this is where Ishmael's choices intersect. This frame was born from a cosmos beyond time with materials beyond human comprehension, as enigmatic as the will of the Observer that operates within.	RoleStory.R4BiankaNormal01	Assets/Product/Texture/Image/IconChouKaRole/DrawCharacterLucia.png					
1331003	RoleStory.R4BiankaNormal01	[5]	[100]	['Amplification', 'Plasma Beam']	['Grants the power of healing and making allies deal more damage.', 'Skills can trigger the Plasma Beam Effect.']		[80, 90, 90, 85, 90, 85]	The convergence of Las Prados's wealth and Project Winter's technologies coalesced into this frame. Its eerie quality emanates not merely from the Ascension-Network's favor but more profoundly from the ambitions and desires deep inside her M.I.N.D., along with secrets buried in history's obscured chapters.	RoleStory.R4BiankaNormal01	Assets/Product/Texture/Image/IconChouKaRole/DrawCharacterLucia.png					
1531005	RoleStory.R4BiankaNormal01	[1]	[100]	['Burst', 'Glaciation']	['Deals massive DMG in a short time.', 'Skills can trigger the Glaciation Effect.']		[80, 90, 90, 85, 90, 85]	A specialized frame co-developed by the Science Council and the World Government Association of Art with improved stability of M.I.N.D. to deal with Transcendants. The adaptee can use it with a suppression device to perform combat skills of multiple parts playing simultaneously.	RoleStory.R4BiankaNormal01	Assets/Product/Texture/Image/IconChouKaRole/DrawCharacterLucia.png					
1341002	RoleStory.R4BiankaNormal01	[5]	[100]	['Burst', 'Ignition']	['Deals massive DMG in a short time.', 'Launches the enemy into the Combustible status and Ignites them.']		[85, 80, 85, 85, 85, 85]	Say goodbye to the warm cradle and confront the painful awakening—she has traversed infinite loops to enter the real world with the full might of the matrix.	RoleStory.R4BiankaNormal01	Assets/Product/Texture/Image/IconChouKaRole/DrawCharacterLucia.png					
1131004	RoleStory.R4BiankaNormal01	[2]	[100]	['Amplification', 'Darkflow']	['Grants the power of healing and making allies deal more damage.', 'Skills can trigger the Darkflow Effect.']		[80, 90, 90, 85, 90, 85]	"A test frame developed by Kurono. It failed the berserk test after activation and was abandoned during a mission. Years later, Vera reactivated the frame, seized its control after fierce combats and chaos, and named it ""Geiravor""."	RoleStory.R4BiankaNormal01	Assets/Product/Texture/Image/IconChouKaRole/DrawCharacterLucia.png					
1351003	RoleStory.R4BiankaNormal01	[1]	[100]	['Burst', 'Ultima Slash']	['Deals massive DMG in a short time.', 'This skill can unleash the Ultima Slash.']		[85, 80, 85, 85, 85, 85]	A legendary devil swordsman who masters lightning-fast quick-draw techniques. The elder twin of Dante.	RoleStory.R4BiankaNormal01	Assets/Product/Texture/Image/IconChouKaRole/DrawCharacterLucia.png					
1361003	RoleStory.R4BiankaNormal01	[2]	[100]	['Burst', 'Ignition']	['Deals massive DMG in a short time.', 'Launches the enemy into the Combustible status and Ignites them.']		[80, 92, 90, 85, 90, 85]	The boss of Devil May Cry, and the most powerful devil hunter alive. Revered for his legendary strength.	RoleStory.R4BiankaNormal01	Assets/Product/Texture/Image/IconChouKaRole/DrawCharacterLucia.png					
1041005	RoleStory.R4BiankaNormal01	[5]	[100]	['Resistance Reduction', 'Raydiance']	['Able to reduce the Resistance of enemies.', 'Skills can trigger the Raydiance Effect.']		[85, 80, 90, 85, 85, 85]	This is a new specialized frame developed by the Science Council, based on further validation of the Phantom Tracer. It can disrupt Punishing information to some extent, effectively weakening its influence.	RoleStory.R4BiankaNormal01	Assets/Product/Texture/Image/IconChouKaRole/DrawCharacterLucia.png					
1371002	RoleStory.R4BiankaNormal01	[1]	[100]	['Resistance Reduction', 'Ultima Slash']	['Able to reduce the Resistance of enemies.', 'This skill can unleash the Ultima Slash.']		[85, 80, 85, 85, 85, 85]	A new frame designed by Babylonia. Compared to Kurono's older model, its M.I.N.D. is less stable, with output levels prone to wide fluctuations.	RoleStory.R4BiankaNormal01	Assets/Product/Texture/Image/IconChouKaRole/DrawCharacterLucia.png					
1381003	RoleStory.R4BiankaNormal01	[1]	[100]	['Amplification', 'Ignition']	['Grants the power of healing and making allies deal more damage', 'Skills can trigger the Ignition Effect.']		[80, 90, 90, 85, 90, 85]	A former member of the Church of Machina, who left the organization for various reasons and now operates independently. Prefers expressing herself through force rather than words.	RoleStory.R4BiankaNormal01	Assets/Product/Texture/Image/IconChouKaRole/DrawCharacterLucia.png					True
1031005	RoleStory.R4BiankaNormal01	[4]	[100]	['Resistance Reduction', 'Darkflow']	['Able to reduce the Resistance of enemies.', 'Skills can trigger the Darkflow Effect.']		[80, 90, 90, 85, 90, 85]	Developed by the Science Council, this new frame integrates data from the Golden Age's Phylotree of Ousia project into the M.I.N.D. Its success marks the dawn of a new era.	RoleStory.R4BiankaNormal01	Assets/Product/Texture/Image/IconChouKaRole/DrawCharacterLucia.png		1	103518		
