Id	Name	NameSp	Selections	MusicTexts	ResCueId	ResText	ResTextSp	ResBg	ResBgSp	IconCd	IconCdSp
101	Practice		[1, 3, 7]	"['""Do you still remember\\nthat song you heard back then...""', '""Do you recall\\nthe instruments accompanying the song...""', '""Do you remember\\nwhich instrument she was playing...""']"	6112	A whale song once incomplete, now restored to its full melody.		Assets/Product/Texture/Image/UiMusicGame/UiArrangementGame/UiArrangementGameCg01.png	Assets/Product/Texture/Image/UiMusicGame/UiArrangementGame/UiArrangementGameCg09.png	Assets/Product/Texture/Image/UiMusicGame/Common/UiMusicGameCd01.png	Assets/Product/Texture/Image/UiMusicGame/Common/UiMusicGameCd09.png
102	The Shepherd		[1, 3, 8]	"['""Do you still remember\\nthat song you heard back then...""', '""Do you recall\\nthe instruments accompanying the song...""', '""Do you remember\\nwhich instrument she was playing...""']"	6113	Hear the pastoral flutes and birdsong - her gifts of blessing to the world.		Assets/Product/Texture/Image/UiMusicGame/UiArrangementGame/UiArrangementGameCg05.png		Assets/Product/Texture/Image/UiMusicGame/Common/UiMusicGameCd05.png	
103	Turandot		[1, 4, 9]	"['""Do you still remember\\nthat song you heard back then...""', '""Do you recall\\nthe instruments accompanying the song...""', '""Do you remember\\nwhich instrument she was playing...""']"	6114	In halls of gilded splendor, she dances like a true princess.		Assets/Product/Texture/Image/UiMusicGame/UiArrangementGame/UiArrangementGameCg02.png		Assets/Product/Texture/Image/UiMusicGame/Common/UiMusicGameCd02.png	
104	The Tempest		[1, 4, 10]	"['""Do you still remember\\nthat song you heard back then...""', '""Do you recall\\nthe instruments accompanying the song...""', '""Do you remember\\nwhich instrument she was playing...""']"	6115	"""All my sorcery cast away; what little might remains belongs to me alone."""		Assets/Product/Texture/Image/UiMusicGame/UiArrangementGame/UiArrangementGameCg07.png		Assets/Product/Texture/Image/UiMusicGame/Common/UiMusicGameCd07.png	
105	Divine Comedy		[2, 5, 11]	"['""Do you still remember\\nthat song you heard back then...""', '""Do you recall\\nthe instruments accompanying the song...""', '""Do you remember\\nwhich instrument she was playing...""']"	6116	Time after time she will climb, until she reaches the pinnacle of Purgatory...		Assets/Product/Texture/Image/UiMusicGame/UiArrangementGame/UiArrangementGameCg04.png		Assets/Product/Texture/Image/UiMusicGame/Common/UiMusicGameCd04.png	
106	▃▄▅▇┳═一	Iris	[2, 5, 12]	"['""Do you still remember\\nthat song you heard back then...""', '""Do you recall\\nthe instruments accompanying the song...""', '""Do you remember\\nwhich instrument she was playing...""']"	6117	A damaged score, its composer lost to time. Now restored and playable via hologram. While nameless, the feelings woven into its notes remain powerful.	Beyond the tempest, through wild lands and darkness, I stand beside you once more. Please, my conductor, speak my name as you once did.	Assets/Product/Texture/Image/UiMusicGame/UiArrangementGame/UiArrangementGameCg08.png	Assets/Product/Texture/Image/UiMusicGame/UiArrangementGame/UiArrangementGameCg10.png	Assets/Product/Texture/Image/UiMusicGame/Common/UiMusicGameCd08.png	Assets/Product/Texture/Image/UiMusicGame/Common/UiMusicGameCd10.png
107	Dr. Faust		[2, 6, 13]	"['""Do you still remember\\nthat song you heard back then...""', '""Do you recall\\nthe instruments accompanying the song...""', '""Do you remember\\nwhich instrument she was playing...""']"	6118	Drowning in the quagmire, yet her eyes mirror the cosmos above.		Assets/Product/Texture/Image/UiMusicGame/UiArrangementGame/UiArrangementGameCg03.png		Assets/Product/Texture/Image/UiMusicGame/Common/UiMusicGameCd03.png	
108	Pied Piper of Hamelin		[2, 6, 14]	"['""Do you still remember\\nthat song you heard back then...""', '""Do you recall\\nthe instruments accompanying the song...""', '""Do you remember\\nwhich instrument she was playing...""']"	6119	Death of a righteous soul.		Assets/Product/Texture/Image/UiMusicGame/UiArrangementGame/UiArrangementGameCg06.png		Assets/Product/Texture/Image/UiMusicGame/Common/UiMusicGameCd06.png	
